"CFIHOS unique id","CFIHOS name","CFIHOS description","created date","modified date","terminated date","change request number","status","CFIHOS definition file"
"CFIHOS-30000600","helideck","A deck that is intended to provide a landing and take-off capability for helicopters.","2019-10-01T00:47:46.434Z","2021-10-12T14:57:36.093Z",,"CR0005;CR0030;CR0029;FR60","STANDARD","tag or equipment class"
"CFIHOS-30000601","life boat","A boat that is intended to rescue people in an emergency case.","2019-10-01T00:47:46.434Z","2021-10-12T14:57:36.093Z",,"CR0005;CR0030;CR0029;FR60","STANDARD","tag or equipment class"
"CFIHOS-30000602","loading arm","A physical object that is designed to load or unload products into or from vehicles, wagons or vessels at variable positions.","2019-10-01T00:47:46.434Z","2021-10-12T14:57:36.093Z",,"CR0005;CR0030;CR0029;FR60","STANDARD","tag or equipment class"
"CFIHOS-30000603","rope","A mechanical cable that is a large stout cord of strands of fibres twisted or braided together.","2019-10-01T00:47:46.434Z","2021-10-12T14:57:36.093Z",,"CR0005;CR0030;CR0029;FR60","STANDARD","tag or equipment class"
"CFIHOS-30000604","trolley","A vehicle that is intended for transporting heavy loads.","2019-10-01T00:47:46.434Z","2021-10-12T14:57:36.093Z",,"CR0005;CR0030;CR0029;FR60","STANDARD","tag or equipment class"
"CFIHOS-30000605","truck","An motor vehicle that is long, low and open intended for carrying goods by road.","2019-10-01T00:47:46.434Z","2021-10-12T14:57:36.093Z",,"CR0005;CR0030;CR0029;FR60","STANDARD","tag or equipment class"
"CFIHOS-30000606","vehicle","A physical object that is any conveyance (usually wheel, e.g. a cart, lorry, motorcar, but also a sledge) for goods or passengers on land.","2019-10-01T00:47:46.434Z","2021-10-12T14:57:36.093Z",,"CR0005;CR0030;CR0029;FR60","STANDARD","tag or equipment class"
"CFIHOS-30000607","actuator","A physical object for changing a signal into a corresponding movement.","2019-10-01T00:47:46.434Z","2021-10-12T14:57:36.093Z",,"CR0001;CR0011;CR0028;CR0029;FR60","STANDARD","tag or equipment class"
"CFIHOS-30000608","automatic identification system","An automatic tracking system used on ships and by vessel traffic services (VTS) for identifying and locating vessels.","2019-10-01T00:47:46.434Z","2021-10-12T14:57:36.093Z",,"CR0001;CR0028;CR0029;FR60;FR69;FR74","STANDARD","tag or equipment class"
"CFIHOS-30000609","blast rated wall","A wall that is designed to retain its integrity against a defined blast loading and fire that may subsequently follow.","2019-10-01T00:47:46.434Z","2021-10-12T14:57:36.093Z",,"CR0001;CR0029;CR0031;FR60;FR74","STANDARD","tag or equipment class"
"CFIHOS-30000610","buckle initiator","A structure to control the formation of lateral buckles along a pipeline or flowline.","2019-10-01T00:47:46.434Z","2021-10-12T14:57:36.093Z",,"CR0001;CR0029;CR0031;FR60;FR69","STANDARD","tag or equipment class"
"CFIHOS-30000611","bund wall","A constructed retaining wall around storage where potentially polluting substances are handled, processed or stored, for the purposes of containing any unintended escape of material from that area until such time as remedial action can be taken.","2019-10-01T00:47:46.434Z","2021-10-12T14:57:36.093Z",,"CR0001;CR0029;FR60;FR69;FR74","STANDARD","tag or equipment class"
"CFIHOS-30000612","bus duct","A physical object that is an assembly of busbar, bus duct enclosure, busbar insulation mounts etc.","2019-10-01T00:47:46.434Z","2021-10-12T14:57:36.093Z",,"CR0001;CR0012;CR0028;CR0029;FR60;FR74","STANDARD","tag or equipment class"
"CFIHOS-30000613","compass","An instrument that indicates either a) magnetic bearings by alignment of its needle on the magnetic poles, or b) reference bearing by radio signal, or c) change of orientation in relation to a gyromaintained line.","2019-10-01T00:47:46.434Z","2021-10-12T14:57:36.093Z",,"CR0001;CR0028;CR0029;FR60","STANDARD","tag or equipment class"
"CFIHOS-30000614","defibrillator","An artefact that is used to control fibrillation of the heart.","2019-10-01T00:47:46.434Z","2021-10-12T14:57:36.093Z",,"CR0001;CR0029;FR60;FR74","STANDARD","tag or equipment class"
"CFIHOS-30000615","diverter","A 'device' that is providing diversion of something from an expected course or direction.","2019-10-01T00:47:46.434Z","2021-10-12T14:57:36.093Z",,"CR0001;CR0029;FR60","STANDARD","tag or equipment class"
"CFIHOS-30000616","electrical reactor","A physical object that provides reactance in a circuit.","2019-10-01T00:47:46.434Z","2021-10-12T14:57:36.093Z",,"CR0001;CR0012;CR0029;FR60;FR52","STANDARD","tag or equipment class"
"CFIHOS-30000617","electrical switch","A switch that turns electrical current on and/or off.","2019-10-01T00:47:46.434Z","2021-10-12T14:57:36.093Z",,"CR0001;CR0028;CR0029;FR60;FR74","STANDARD","tag or equipment class"
"CFIHOS-30000618","emergency position indicating radio beacon","A radio beacon in the mobile service the emissions of which are intended to facilitate search and rescue operations (EPIRB).","2019-10-01T00:47:46.434Z","2021-10-12T14:57:36.093Z",,"CR0001;CR0028;CR0029;FR60;FR74","STANDARD","tag or equipment class"
"CFIHOS-30000619","fire wall","A wall which is also a fire divider.","2019-10-01T00:47:46.434Z","2021-10-12T14:57:36.093Z",,"CR0001;CR0029;CR0031;FR60;FR74","STANDARD","tag or equipment class"
"CFIHOS-30000620","hvac duct","A large sheet-metal duct or casing through which air is passed for forced-draught, ventilation or air-conditioning purposes.","2019-10-01T00:47:46.434Z","2021-10-12T14:57:36.093Z",,"CR0001;CR0029;FR60","STANDARD","tag or equipment class"
"CFIHOS-30000621","injection point","Intended to inject material. Typically it consists of a pipe connected to an item and a valve in the pipe.","2019-10-01T00:47:46.434Z","2021-10-12T14:57:36.093Z",,"CR0001;CR0029;FR60;FR69;FR74","STANDARD","tag or equipment class"
"CFIHOS-30000622","lifting jack","A lifting device, usually portable, for lifting heavy weights by force acting from below; in the commonest form, having a rack and a pinion wheel or screw and a handle turned by hand.","2019-10-01T00:47:46.434Z","2021-10-12T14:57:36.093Z",,"CR0001;CR0028;CR0029;FR60;FR74","STANDARD","tag or equipment class"
"CFIHOS-30000623","motor control centre","A switchgear and controlgear that houses motor starters to control electric motors.","2019-10-01T00:47:46.434Z","2021-10-12T14:57:36.093Z",,"CR0001;CR0012;CR0029;FR60","STANDARD","tag or equipment class"
"CFIHOS-30000624","pressure relief damper","A gas flow damper that is used to relieve built-up pressure in a duct system to prevent damage to HVAC equipment.","2019-10-01T00:47:46.434Z","2021-10-12T14:57:36.093Z",,"CR0001;CR0028;CR0029;FR60","STANDARD","tag or equipment class"
"CFIHOS-30000625","line","A closed fluid transport device that is intended to provide transport capabilities for fluids within a process plant.","2019-10-01T00:47:46.434Z","2021-10-12T14:57:36.093Z","2021-10-12T14:57:36.093Z","CR0001;CR0028;CR0029;FR60","TERMINATED","tag or equipment class"
"CFIHOS-30000626","radar","A physical object for detecting the presence of objects at a distance, or ascertaining their position or motion, by transmitting short radio waves and detecting or measuring their return after being reflected.","2019-10-01T00:47:46.434Z","2021-10-12T14:57:36.093Z",,"CR0001;CR0028;CR0029;FR60;FR74","STANDARD","tag or equipment class"
"CFIHOS-30000627","radio beacon","A radio transmitter, usually non-directional, that emits identifiable signals intended for radio direction-finding.","2019-10-01T00:47:46.434Z","2021-10-12T14:57:36.093Z",,"CR0001;CR0029;FR60;FR74","STANDARD","tag or equipment class"
"CFIHOS-30000628","running tool","A tool that can be used to install or remove machines or equipment.","2019-10-01T00:47:46.434Z","2021-10-12T14:57:36.093Z",,"CR0001;CR0029;FR60;FR74","STANDARD","tag or equipment class"
"CFIHOS-30000629","slip ring","A ring of conducting material which is attached to and rotates with a shaft, so that the electric current may be transferred to a stationary circuit through a fixed brush pressing against it.","2019-10-01T00:47:46.434Z","2021-10-12T14:57:36.093Z",,"CR0001;CR0028;CR0029;FR60;FR74","STANDARD","tag or equipment class"
"CFIHOS-30000630","static mixer","A physical object that is intended to mix fluid by means of diverging the flow with static obstacles or by increasing locally the velocity.","2019-10-01T00:47:46.434Z","2021-10-12T14:57:36.093Z",,"CR0001;CR0009;CR0029;FR60","STANDARD","tag or equipment class"
"CFIHOS-30000631","thruster","A physical object that includes a water jet or propeller used on vessels intended to provide a means to move the vessel sideways for maintaining the vessel's position without anchors.","2019-10-01T00:47:46.434Z","2021-10-12T14:57:36.093Z",,"CR0001;CR0029;CR0031;FR60","STANDARD","tag or equipment class"
"CFIHOS-30000632","wall","Which is flat and typically vertical suitable for separation.","2019-10-01T00:47:46.434Z","2021-10-12T14:57:36.093Z",,"CR0001;CR0029;FR60;FR74","STANDARD","tag or equipment class"
"CFIHOS-30000633","watercraft","A physical object that is intended for water transport.","2019-10-01T00:47:46.434Z","2021-10-12T14:57:36.093Z",,"CR0001;CR0029;FR60","STANDARD","tag or equipment class"
"CFIHOS-30000634","vacuum relief valve","A relief valve that is used for pressure compensation purposes by admitting (letting in) a pressure to prevent that vacuum is forming when filling or emptying a system.","2019-10-01T00:47:46.434Z","2021-10-12T14:57:36.093Z",,"CR0002;CR0011;CR0029;FR60","STANDARD","tag or equipment class"
"CFIHOS-30000635","blow down valve","A valve that can be used for rapid depressurizing of a high pressure system.","2019-10-01T00:47:46.434Z","2021-10-12T14:57:36.093Z",,"CR0002;CR0029;FR60","STANDARD","tag or equipment class"
"CFIHOS-30000636","check valve","A valve that permits fluid to flow in one direction only.","2019-10-01T00:47:46.434Z","2021-10-12T14:57:36.093Z",,"CR0002;CR0011;CR0028;CR0029;FR60","STANDARD","tag or equipment class"
"CFIHOS-30000637","compensator","A device compensating for axial or radial movement between two elements that is connected.","2019-10-01T00:47:46.434Z","2021-10-12T14:57:36.093Z",,"CR0002;CR0028;CR0029;FR60","STANDARD","tag or equipment class"
"CFIHOS-30000638","control valve","A valve that can be used to modify (regulate) the fluid flow rate in a process control system. It usually includes an actuator, which responds to a signal from the controlling system and changes the position of the flow controlling element in the valve.","2019-10-01T00:47:46.434Z","2021-10-12T14:57:36.093Z",,"CR0002;CR0011;CR0028;CR0029;FR60","STANDARD","tag or equipment class"
"CFIHOS-30000639","deluge valve","A control valve that is intended to operate at high temperature, and admit water into a deluge system.","2019-10-01T00:47:46.434Z","2021-10-12T14:57:36.093Z",,"CR0002;CR0011;CR0029;FR60","STANDARD","tag or equipment class"
"CFIHOS-30000640","detector","A physical object that is an assembly of a sensing element and necessary ancillary devices making it able of detecting a state, e.g. pressure, temperature, or detect the presence of a selected substance, and produce a signal based on the detection.","2019-10-01T00:47:46.434Z","2021-10-12T14:57:36.093Z",,"CR0002;CR0014;CR0029;FR60","STANDARD","tag or equipment class"
"CFIHOS-30000641","electronic circuit board","A physical object that comprises a printed circuit board with electronic components intended for receive, process/transform and transmit electrical signals.","2019-10-01T00:47:46.434Z","2021-10-12T14:57:36.093Z",,"CR0002;CR0029;FR60","STANDARD","tag or equipment class"
"CFIHOS-30000642","emergency shut down valve","A valve that is assigned to act in case of emergency.","2019-10-01T00:47:46.434Z","2021-10-12T14:57:36.093Z",,"CR0002;CR0029;FR60","STANDARD","tag or equipment class"
"CFIHOS-30000643","flow transmitter","A flow transmitter providing an output signal that is proportional to the flow inputs from a flow element.","2019-10-01T00:47:46.434Z","2021-10-12T14:57:36.093Z",,"CR0002;CR0014;CR0028;CR0029;FR60","STANDARD","tag or equipment class"
"CFIHOS-30000644","galley equipment","An 'equipment class' that is a class of devices whose members normally is a part of the outfitting of a galley.","2019-10-01T00:47:46.434Z","2021-10-12T14:57:36.093Z",,"CR0002;CR0028;CR0029;FR60","STANDARD","tag or equipment class"
"CFIHOS-30000645","hose connector","A connector intended for hose connection.","2019-10-01T00:47:46.434Z","2021-10-12T14:57:36.093Z",,"CR0002;CR0029;FR60","STANDARD","tag or equipment class"
"CFIHOS-30000646","level transmitter","A transmitter that produces a continuous standardized output signal dependent of a received input signal from a level sensor.","2019-10-01T00:47:46.434Z","2021-10-12T14:57:36.093Z",,"CR0002;CR0014;CR0029;FR60","STANDARD","tag or equipment class"
"CFIHOS-30000647","local area network","A data communication system intended for communication between parties in a restricted area.","2019-10-01T00:47:46.434Z","2021-10-12T14:57:36.093Z",,"CR0002;CR0029;FR60;FR69","STANDARD","tag or equipment class"
"CFIHOS-30000648","manhole","A nozzle that is a hole of sufficient size to allow a person to enter a vessel.","2019-10-01T00:47:46.434Z","2021-10-12T14:57:36.093Z",,"CR0002;CR0029;FR60","STANDARD","tag or equipment class"
"CFIHOS-30000649","manual valve","A valve that is regulated with hand power.","2019-10-01T00:47:46.434Z","2021-10-12T14:57:36.093Z",,"CR0002;CR0011;CR0029;FR60","STANDARD","tag or equipment class"
"CFIHOS-30000650","non-return damper","A gas flow damper that prevents back flow in a duct.","2019-10-01T00:47:46.434Z","2021-10-12T14:57:36.093Z",,"CR0002;CR0028;CR0029;FR60","STANDARD","tag or equipment class"
"CFIHOS-30000651","on-off valve","A control valve that only has two defined positions, being fully open and fully closed.","2019-10-01T00:47:46.434Z","2021-10-12T14:57:36.093Z","2021-10-12T14:57:36.093Z","CR0002;CR0011;CR0029;FR60","TERMINATED","tag or equipment class"
"CFIHOS-30000652","physical access control equipment","Physical access control equipment and/or systems intended to regulate or control entry into and/or exit from a controlled area, protected area or a restricted area.","2019-10-01T00:47:46.434Z","2021-10-12T14:57:36.093Z",,"CR0002;CR0028;CR0029;FR60;FR69","STANDARD","tag or equipment class"
"CFIHOS-30000653","pressure relief device","A fluid regulator that relieves pressure from an enclosed space when the pressure reaches a predetermined value.","2019-10-01T00:47:46.434Z","2021-10-12T14:57:36.093Z",,"CR0002;CR0011;CR0028;CR0029;FR60","STANDARD","tag or equipment class"
"CFIHOS-30000654","pressure transmitter","A transmitter that is producing a standardized output signal dependent of a received input signal from a pressure element.","2019-10-01T00:47:46.434Z","2021-10-12T14:57:36.093Z",,"CR0002;CR0014;CR0029;FR60","STANDARD","tag or equipment class"
"CFIHOS-30000655","process nozzle","A nozzle intended to enable transfer of process material.","2019-10-01T00:47:46.434Z","2021-10-12T14:57:36.093Z",,"CR0002;CR0029;FR60","STANDARD","tag or equipment class"
"CFIHOS-30000656","riser support","A support connecting a riser to a structure.","2019-10-01T00:47:46.434Z","2021-10-12T14:57:36.093Z",,"CR0002;CR0029;FR60;FR74","STANDARD","tag or equipment class"
"CFIHOS-30000657","spray nozzle","A nozzle where liquid is introduced under pressure.","2019-10-01T00:47:46.434Z","2021-10-12T14:57:36.093Z",,"CR0002;CR0029;FR60","STANDARD","tag or equipment class"
"CFIHOS-30000658","telecom gateway","In a communications network, a network node equipped for interfacing with another network that uses different protocols.","2019-10-01T00:47:46.434Z","2021-10-12T14:57:36.093Z",,"CR0002;CR0028;CR0029;FR60;FR69","STANDARD","tag or equipment class"
"CFIHOS-30000659","termination panel","An 'artefact' intended for the termination of cables.","2019-10-01T00:47:46.434Z","2021-10-12T14:57:36.093Z",,"CR0002;CR0028;CR0029;FR60","STANDARD","tag or equipment class"
"CFIHOS-30000660","valve","A fluid regulator that can be used to control (i.e. permit, obstruct, regulate or divert) a fluid stream.","2019-10-01T00:47:46.434Z","2021-10-12T14:57:36.093Z",,"CR0002;CR0011;CR0029;FR60","STANDARD","tag or equipment class"
"CFIHOS-30000661","transmitter","A physical object that is an element that receives a process variable signal from a sensor and converts it into an output signal.","2019-10-01T00:47:46.434Z","2021-10-12T14:57:36.093Z",,"CR0002;CR0014;CR0029;FR60","STANDARD","tag or equipment class"
"CFIHOS-30000662","flow totalizer","A totalizer that adds up flow measurements.","2019-10-01T00:47:46.434Z","2021-10-12T14:57:36.093Z",,"CR0002;CR0014;CR0029;FR60","STANDARD","tag or equipment class"
"CFIHOS-30000663","signal converter","An electric signal transducer that is intended to convert one type of standardized transmission signal into another.","2019-10-01T00:47:46.434Z","2021-10-12T14:57:36.093Z",,"CR0002;CR0014;CR0029;FR60","STANDARD","tag or equipment class"
"CFIHOS-30000664","orifice plate","A physical object that is a thin plate with a specified hole in the middle. It is usually placed in a pipe to measure the rate of fluid flow.","2019-10-01T00:47:46.434Z","2021-10-12T14:57:36.093Z",,"CR0002;CR0014;CR0029;FR60","STANDARD","tag or equipment class"
"CFIHOS-30000665","detecting element","A physical object that is the primary element of a measuring chain which converts the input variable into a signal suitable for measurement.","2019-10-01T00:47:46.434Z","2021-10-12T14:57:36.093Z",,"CR0002;CR0014;CR0029;FR60","STANDARD","tag or equipment class"
"CFIHOS-30000666","controller","A regulator that operates automatically to affect a controlled variable by comparing the value of the controlled variable with the value of a reference variable in order to reduce the difference between them.","2019-10-01T00:47:46.434Z","2021-10-12T14:57:36.093Z",,"CR0002;CR0014;CR0029;FR60","STANDARD","tag or equipment class"
"CFIHOS-30000667","drilling equipment","Equipment intended to enable the drilling of holes. Typically in the earth for oil and/or gas production.","2019-10-01T00:47:46.434Z","2021-10-12T14:57:36.093Z",,"CR0002;CR0029;FR60;FR69","STANDARD","tag or equipment class"
"CFIHOS-30000668","bell nipple","A Bell nipple is a section of large diameter pipe fitted to the top of the blowout preventers that the flow line attaches to via a side outlet, to allow the drilling fluid to flow back over the shale shakers to the mud tanks. Also an enlarged pipe at the top of a casing string that serves as a funnel to guide drilling tools into the top of a well.","2019-10-01T00:47:46.434Z","2021-10-12T14:57:36.093Z",,"CR0002;CR0029;FR60;FR69","STANDARD","tag or equipment class"
"CFIHOS-30000669","drilling standpipe","A rigid metal conduit that provides the high-pressure pathway for drilling mud to travel approximately one-third of the way up the derrick, where it connects to a flexible high-pressure hose (kelly hose).","2019-10-01T00:47:46.434Z","2021-10-12T14:57:36.093Z",,"CR0002;CR0029;FR60;FR69","STANDARD","tag or equipment class"
"CFIHOS-30000670","pipe doping machine","A device that is designed for easy washing and dope application of drill pipe threads and collar threads.","2019-10-01T00:47:46.434Z","2021-10-12T14:57:36.093Z",,"CR0002;CR0029;FR60;FR69","STANDARD","tag or equipment class"
"CFIHOS-30000671","flow element","A detecting element that is producing a signal that is proportional to a flow rate.","2019-10-01T00:47:46.434Z","2021-10-12T14:57:36.093Z",,"CR0002;CR0014;CR0028;CR0029;FR60","STANDARD","tag or equipment class"
"CFIHOS-30000672","level element","A detecting element that is intended to determine a level.","2019-10-01T00:47:46.434Z","2021-10-12T14:57:36.093Z",,"CR0002;CR0014;CR0028;CR0029;FR60","STANDARD","tag or equipment class"
"CFIHOS-30000673","pressure element","A detecting element intended to sense pressure.","2019-10-01T00:47:46.434Z","2021-10-12T14:57:36.093Z",,"CR0002;CR0014;CR0029;FR60","STANDARD","tag or equipment class"
"CFIHOS-30000674","temperature element","A detecting element intended to sense temperature.","2019-10-01T00:47:46.434Z","2021-10-12T14:57:36.093Z",,"CR0002;CR0014;CR0029;FR60","STANDARD","tag or equipment class"
"CFIHOS-30000675","gauge","A detecting instrument that is used for measuring or testing.","2019-10-01T00:47:46.434Z","2021-10-12T14:57:36.093Z",,"CR0002;CR0014;CR0029;FR60","STANDARD","tag or equipment class"
"CFIHOS-30000676","control switch","A switch intended to switch or give an on/off signal when the measured variable has reached a pre-set value.","2019-10-01T00:47:46.434Z","2021-10-12T14:57:36.093Z",,"CR0002;CR0014;CR0030;CR0029;FR60","STANDARD","tag or equipment class"
"CFIHOS-30000677","level switch","A functional switch that is intended to give an on/off signal when particulate material or fluid level have reached a pre-set value.","2019-10-01T00:47:46.434Z","2021-10-12T14:57:36.093Z",,"CR0002;CR0014;CR0028;CR0030;CR0029;FR60","STANDARD","tag or equipment class"
"CFIHOS-30000678","position switch","A pilot switch the actuating system of which is operated by a moving part of a machine, when this part reaches a predetermined position.","2019-10-01T00:47:46.434Z","2021-10-12T14:57:36.093Z",,"CR0002;CR0014;CR0029;FR60","STANDARD","tag or equipment class"
"CFIHOS-30000679","subsea distribution unit","An artefact where hydraulics, chemicals, electrical power and signals are distributed from the main umbilicals to different subsea systems.","2019-10-01T00:47:46.434Z","2021-10-12T14:57:36.093Z",,"CR0002;CR0015;CR0029;FR60","STANDARD","tag or equipment class"
"CFIHOS-30000680","iron roughneck","An integral part of the drilling process, iron roughnecks connect and disconnect drill pipe. Whether pipe is being fed into the wellbore or it is being taken out, the iron roughneck uses a rotary table and torque wrench(es) to make up or break down pipe.","2019-10-01T00:47:46.434Z","2021-10-12T14:57:36.093Z",,"CR0002;CR0029;FR60;FR69","STANDARD","tag or equipment class"
"CFIHOS-30000681","solenoid valve","A valve that has linear action which is fitted with a solenoid for quick operation.","2019-10-01T00:47:46.434Z","2021-10-12T14:57:36.093Z",,"CR0002;CR0011;CR0029;FR60","STANDARD","tag or equipment class"
"CFIHOS-30000682","self operating valve","A valve that includes a means of operation (e.g. spring / gravity / fluid pressure / counter balance), and is not depending on an external source of energy.","2019-10-01T00:47:46.434Z","2021-10-12T14:57:36.093Z",,"CR0002;CR0011;CR0028;CR0029;FR60","STANDARD","tag or equipment class"
"CFIHOS-30000683","engine","An internal combustion engine that is an induction compression ignition exhaust engine which ignites a fuel air mixture.","2019-10-01T00:47:46.434Z","2021-10-12T14:57:36.093Z",,"CR0009;CR0029;FR60","STANDARD","tag or equipment class"
"CFIHOS-30000684","motor","A device that generates rotational kinetic energy.","2019-10-01T00:47:46.434Z","2021-10-12T14:57:36.093Z",,"CR0009;CR0029;FR60","STANDARD","tag or equipment class"
"CFIHOS-30000685","turbine","A physical object that is intended to rotate within a fluid and to transform energy within a fluid into mechanical power.","2019-10-01T00:47:46.434Z","2021-10-12T14:57:36.093Z",,"CR0009;CR0029;FR60","STANDARD","tag or equipment class"
"CFIHOS-30000686","dust detector","A 'detector' for measuring the velocity, mass, charge, flight direction, and number of dust particles in space.","2019-10-01T00:47:46.434Z","2021-10-12T14:57:36.093Z",,"CR0014;CR0029;FR60","STANDARD","tag or equipment class"
"CFIHOS-30000687","level gauge","A gauge that is intended to display a representation of a measured level.","2019-10-01T00:47:46.434Z","2021-10-12T14:57:36.093Z",,"CR0014;CR0029;FR60","STANDARD","tag or equipment class"
"CFIHOS-30000688","multiphase meter","A flow meter for the metering a mixture of two or more fluid phases.","2019-10-01T00:47:46.434Z","2021-10-12T14:57:36.093Z",,"CR0014;CR0029;FR60","STANDARD","tag or equipment class"
"CFIHOS-30000689","oil mist detector","A mist detector that is intended to detect oil mist.","2019-10-01T00:47:46.434Z","2021-10-12T14:57:36.093Z",,"CR0014;CR0029;FR60","STANDARD","tag or equipment class"
"CFIHOS-30000690","speed switch","A switch intended to give a on/off signal when the speed have reached a pre-set value.","2019-10-01T00:47:46.434Z","2021-10-12T14:57:36.093Z",,"CR0014;CR0030;CR0029;FR60","STANDARD","tag or equipment class"
"CFIHOS-30000691","flow indicator","An indicating instrument that is intended to give a visual indication of mass or volume per time unit of a fluid passing through an open or closed conduit.","2019-10-01T00:47:46.434Z","2021-10-12T14:57:36.093Z","2021-10-12T14:57:36.093Z","CR0014;CR0028;CR0029;FR60","TERMINATED","tag or equipment class"
"CFIHOS-30000692","level indicator","An indicating instrument that is intended to give a visual indication of the level of a substance behaving like a fluid in a tank or storing device.","2019-10-01T00:47:46.434Z","2021-10-12T14:57:36.093Z","2021-10-12T14:57:36.093Z","CR0014;CR0028;CR0029;FR60","TERMINATED","tag or equipment class"
"CFIHOS-30000693","pressure indicator","An indicating instrument that is intended to give a visual indication of the pressure in a pre defined process segment.","2019-10-01T00:47:46.434Z","2021-10-12T14:57:36.093Z","2021-10-12T14:57:36.093Z","CR0014;CR0028;CR0029;FR60","TERMINATED","tag or equipment class"
"CFIHOS-30000694","temperature indicator","An indicating instrument that is intended to give a visual indication of a temperature.","2019-10-01T00:47:46.434Z","2021-10-12T14:57:36.093Z","2021-10-12T14:57:36.093Z","CR0014;CR0028;CR0029;FR60","TERMINATED","tag or equipment class"
