"CFIHOS unique id","CFIHOS name","CFIHOS description","created date","modified date","terminated date","change request number","status","CFIHOS definition file"
"CFIHOS-20000919","JA6944","A report documenting progress made against a previously communicated plan or schedule.  Progress Reports can address time, scope, money, etc.","2017-02-13T21:51:20.370Z","2021-10-14T10:00:28.825Z","2021-10-14T10:00:28.825Z","CR0027;FR74","TERMINATED","discipline document type"
"CFIHOS-20000920","JA7712","Specification of the Information types required by the owner for delivery and handover.","2017-02-13T21:51:20.370Z","2021-10-14T10:00:28.825Z",,"CR0027;FR27;FR74","STANDARD","discipline document type"
"CFIHOS-20000921","JA7739","A specification describing scope and objectives of the project and its execution; details to be provided by Owner Operator.","2017-02-13T21:51:20.370Z","2021-10-14T10:00:28.825Z",,"CR0027;FR27;FR74","STANDARD","discipline document type"
"CFIHOS-20000922","JA7753","A document capturing scope and details of the activity to which it refers and any conditions relating to the appointment of a person(s) to undertake the activity. Includes the distribution of work, schedule and the responsibilities among the people participating in an evaluation process.","2017-02-13T21:51:20.370Z","2021-10-14T10:00:28.825Z",,"CR0027;FR27;FR74","STANDARD","discipline document type"
"CFIHOS-20000923","JA7880","A document formally establishing the mandatory limits or parameters which are to be met. Not to be used if a more specific document type can be used.  Can be used for singular/specialty deliverables which do not have a unique document type.","2017-02-13T21:51:20.370Z","2021-10-14T10:00:28.825Z",,"CR0027;CR0030;FR27;FR74","STANDARD","discipline document type"
"CFIHOS-20000924","JA8380","A document detailing the result of a professional evaluation and/or investigation of a specific subject. Not to be used if a more specific document type can be used.  Can be used for singular/specialty deliverables which do not have a unique document type.","2017-02-13T21:51:20.370Z","2021-10-14T10:00:28.825Z",,"CR0027;CR0030;FR27;FR74","STANDARD","discipline document type"
"CFIHOS-20000925","KA3304","A computer program designed for a specific task or use.","2017-02-13T21:51:20.370Z","2021-10-14T10:00:28.825Z",,"CR0027;FR27;FR74","STANDARD","discipline document type"
"CFIHOS-20000926","KA3375","Step by step instruction for the accomplishment of a task. more detailed than a procedure.","2017-02-13T21:51:20.370Z","2021-10-14T10:00:28.825Z",,"CR0027;FR27;FR74","STANDARD","discipline document type"
"CFIHOS-20000927","KA4880","A document that describes methods of working to be used to accomplish an activity. Synonym: Guide, Guideline. Warning: this should not be a compilation of other deliverables. Not to be used if a more specific document type can be used.  Can be used for singular/specialty deliverables which do not have a unique document type.","2017-02-13T21:51:20.370Z","2021-10-14T10:00:28.825Z",,"CR0027;FR27;FR74","STANDARD","discipline document type"
"CFIHOS-20000928","KA5798","A document capturing key discipline execution plans applicable across the project scope (e.g., IM Plan, Execution Plan, Quality Plan).","2017-02-13T21:51:20.370Z","2021-10-14T10:00:28.825Z",,"CR0027;FR27;FR74","STANDARD","discipline document type"
"CFIHOS-20000929","KA5980","A document outlining the application of a philosophical stance for decisions and the resulting principles that are to be followed to achieve the intent. Typically developed based on a philosophy.","2017-02-13T21:51:20.370Z","2021-10-14T10:00:28.825Z",,"CR0027;CR0030;FR27;FR74","STANDARD","discipline document type"
"CFIHOS-20000930","KA6180","A document which describes a set of logically sequenced instructions to execute an activity. Not to be used if a more specific document type can be used.  Can be used for singular/speciality deliverables which do not have a unique document type.","2017-02-13T21:51:20.370Z","2021-10-14T10:00:28.825Z",,"CR0027;FR27;FR74","STANDARD","discipline document type"
"CFIHOS-20000931","KA7205","A request, approval or rejection of changes to a technical specification. Would typically include justification and reasons for the request, and acceptance or rejection from a purely technical perspective. Synonym: Concession, Change Request.","2017-02-13T21:51:20.370Z","2021-10-14T10:00:28.825Z",,"CR0027;FR27;FR74","STANDARD","discipline document type"
"CFIHOS-20000932","KA7303","A request with a brief description of the parts to be ordered, with a statement of the pertinent drawings, specifications, etc., as well as a list of drawings and documents to be provided by the manufacturer/supplier.","2017-02-13T21:51:20.370Z","2021-10-14T10:00:28.825Z",,"CR0027;FR27;FR74","STANDARD","discipline document type"
"CFIHOS-20000933","KA7739","A specification describing scope and objectives of the project and its execution; details to be provided by Owner Operator.","2017-02-13T21:51:20.370Z","2021-10-14T10:00:28.825Z",,"CR0027;FR27;FR74","STANDARD","discipline document type"
"CFIHOS-20000934","KA7753","A document capturing scope and details of the activity to which it refers and any conditions relating to the appointment of a person(s) to undertake the activity. Includes the distribution of work, schedule and the responsibilities among the people participating in an evaluation process.","2017-02-13T21:51:20.370Z","2021-10-14T10:00:28.825Z",,"CR0027;FR27;FR74","STANDARD","discipline document type"
"CFIHOS-20000935","KA7880","A document formally establishing the mandatory limits or parameters which are to be met. Not to be used if a more specific document type can be used.  Can be used for singular/specialty deliverables which do not have a unique document type.","2017-02-13T21:51:20.370Z","2021-10-14T10:00:28.825Z",,"CR0027;CR0030;FR27;FR74","STANDARD","discipline document type"
"CFIHOS-20000936","KA8380","A document detailing the result of a professional evaluation and/or investigation of a specific subject. Not to be used if a more specific document type can be used.  Can be used for singular/specialty deliverables which do not have a unique document type.","2017-02-13T21:51:20.370Z","2021-10-14T10:00:28.825Z",,"CR0027;CR0030;FR27;FR74","STANDARD","discipline document type"
"CFIHOS-20000937","KA8502","Request (e.g., from a Contractor) for clarification of scope, technical details, or assumptions. Synonyms include Technical Query (TQ) and Request for Information (RFI).","2017-02-13T21:51:20.370Z","2021-10-14T10:00:28.825Z",,"CR0027;FR27;FR74","STANDARD","discipline document type"
"CFIHOS-20000938","LA0510","A report to ensure pipeline stability under extreme environmental loading.","2017-02-13T21:51:20.370Z","2021-10-14T14:53:14.601Z",,"CR0027;FR27;FR74","STANDARD","discipline document type"
"CFIHOS-20000939","LA0515",,"2017-02-13T21:51:20.370Z","2021-10-14T14:53:14.601Z","2021-10-14T14:53:14.601Z","CR0027;FR74","TERMINATED","discipline document type"
"CFIHOS-20000940","LA0580","A report documenting  assumptions and method determining objective analysis of a set of data. Not to be used if a more specific document type can be used.  Can be used for singular/specialty deliverables which do not have a unique document type.","2017-02-13T21:51:20.370Z","2021-10-14T14:53:14.601Z",,"CR0027;FR27;FR74","STANDARD","discipline document type"
"CFIHOS-20000941","LA1206","A calculations prepared in order to prove that the item of equipment or system selected meets the design criteria.","2017-02-13T21:51:20.370Z","2021-10-14T10:00:28.825Z",,"CR0027;FR27;FR74","STANDARD","discipline document type"
"CFIHOS-20000942","LA1231","Includes mass, buoyancy, and calculations used in the design of weight coating (eg. on submerged pipelines).","2017-02-13T21:51:20.370Z","2021-10-14T10:00:28.825Z",,"CR0027;CR0030;FR27;FR74","STANDARD","discipline document type"
"CFIHOS-20000943","LA1380","A document showing inputs, formulas, rationale, and conclusions/mathematical results as required to enhance design or bound activities.","2017-02-13T21:51:20.370Z","2021-10-14T10:00:28.825Z",,"CR0027;FR27;FR74","STANDARD","discipline document type"
"CFIHOS-20000944","LA2105","A datasheet which provides precise information about a  tag and compliments equipment specification.","2017-02-13T21:51:20.370Z","2021-10-14T10:00:28.825Z",,"CR0027;CR0030;FR27;FR74","STANDARD","discipline document type"
"CFIHOS-20000945","LA2373","A diagram showing alignment of cables and pipelines between plants. Includes alignment sheet for pipelines.","2017-02-13T21:51:20.370Z","2021-10-14T10:00:28.825Z",,"CR0027;FR27;FR74","STANDARD","discipline document type"
"CFIHOS-20000946","LA3323","A communication documenting how an engineering or maintenance issue will be resolved and what the implication of the solution is.","2017-02-13T21:51:20.370Z","2021-10-14T10:00:28.825Z",,"CR0027;FR27;FR74","STANDARD","discipline document type"
"CFIHOS-20000947","LA3328","A document that describes methods of installing a piece of equipment.  Installation refers to the mounting, setting, erection, etc.","2017-02-13T21:51:20.370Z","2021-10-14T10:00:28.825Z",,"CR0027;FR27;FR74","STANDARD","discipline document type"
"CFIHOS-20000948","LA3331","A document explaining how the design of a major part of a facility has been conducted in accordance with the design philosophy.  It presents the essential characteristics (e.g. design properties, operating conditions) of the facility designed, and makes references to other documents giving more detailed information about the design. This document type can be used to classify documents like pipeline design report, riser design report.","2017-02-13T21:51:20.370Z","2021-10-14T10:00:28.825Z","2021-10-14T10:00:28.825Z","CR0027;FR74","TERMINATED","discipline document type"
"CFIHOS-20000949","LA3880","A report documenting status and observations relating to an asset/object.  Can include paint, insulation, thickness measurement, destructive weld testing, NDE, preservation, cathodic protection tests, etc. Excludes pressure tests.","2017-02-13T21:51:20.370Z","2021-10-14T10:00:28.825Z","2021-10-14T10:00:28.825Z","CR0027;FR74","TERMINATED","discipline document type"
"CFIHOS-20000950","LA4018","A diagram showing the main features and locations of major items. Usually has some dimensions to convey spatial relationships but is generally inadequate for construction.","2017-02-13T21:51:20.370Z","2021-10-14T10:00:28.825Z",,"CR0027;CR0030;FR27;FR74","STANDARD","discipline document type"
"CFIHOS-20000951","LA4024","A plan view diagram of a plant/group of plants showing the interfaces of layout diagrams of components.  Typically only shows major equipment and infrastructure to provide context and orientation.","2017-02-13T21:51:20.370Z","2021-10-14T10:00:28.825Z",,"CR0027;FR27;FR74","STANDARD","discipline document type"
"CFIHOS-20000952","LA4306","A list of all parts and sub assemblies that constitute a particular assembly, showing the quantity of each required item. Typically developed from analyzing a drawing.","2017-02-13T21:51:20.370Z","2021-10-14T10:00:28.825Z",,"CR0027;FR27;FR74","STANDARD","discipline document type"
"CFIHOS-20000953","LA4322","A customized list developed to support discipline activities, extract from a Register that is used as a secondary reference (i.e. not the master). Considers all potential disciplines. Covers: conduits, panels, pipe supports, piping speciality items, lighting, etc.","2017-02-13T21:51:20.370Z","2021-10-14T10:00:28.825Z",,"CR0027;CR0030;FR27;FR74","STANDARD","discipline document type"
"CFIHOS-20000954","LA4363","Tie-in list identifies areas of a brownfield facility where connections will be made. May include interfaces between project stages, contractors and systems (e.g. new to existing plant connections).","2017-02-13T21:51:20.370Z","2021-10-14T10:00:28.825Z","2021-10-14T10:00:28.825Z","CR0027;FR74","TERMINATED","discipline document type"
"CFIHOS-20000955","LA5009","To include main threats, materials requirements, pre-selection, detailed selection with cost-benefit analysis and the operating envelope of the final material choice.","2017-02-13T21:51:20.370Z","2021-10-14T10:00:28.825Z","2021-10-14T10:00:28.825Z","CR0027;FR74","TERMINATED","discipline document type"
"CFIHOS-20000956","LA5507","A document outlining the premise and intent for decisions that are to be followed regarding a design. A set of ideas, beliefs, or underlying theory.","2017-02-13T21:51:20.370Z","2021-10-14T10:00:28.825Z",,"CR0027;FR27;FR74","STANDARD","discipline document type"
"CFIHOS-20000957","LA5787",,"2017-02-13T21:51:20.370Z","2021-10-14T10:00:28.825Z","2021-10-14T10:00:28.825Z","CR0027;FR74","TERMINATED","discipline document type"
"CFIHOS-20000958","LA5880","A document capturing what particular activities and requirements will be executed and delivered.  Typically the plan is built upon a strategy.","2017-02-13T21:51:20.370Z","2021-10-14T10:00:28.825Z",,"CR0027;FR27;FR74","STANDARD","discipline document type"
"CFIHOS-20000959","LA6046","A procedure documenting specific steps to conduct inspection of an asset/object.  Typically details boundaries of the test, isolations, method of pressurization, required hold intervals etc.  Includes hydrostatic, pneumatic, vacuum and leak test/examinations.","2017-02-13T21:51:20.370Z","2021-10-14T10:00:28.825Z",,"CR0027;FR27;FR74","STANDARD","discipline document type"
"CFIHOS-20000960","LA6180","A document which describes a set of logically sequenced instructions to execute an activity. Not to be used if a more specific document type can be used.  Can be used for singular/speciality deliverables which do not have a unique document type.","2017-02-13T21:51:20.370Z","2021-10-14T10:00:28.825Z",,"CR0027;FR27;FR74","STANDARD","discipline document type"
"CFIHOS-20000961","LA6612","An authoritative collection of values with a relationship to a specific equipment or tag.  The columns of this collection is specified and controlled.","2017-02-13T21:51:20.370Z","2021-10-14T10:00:28.825Z","2021-10-14T10:00:28.825Z","CR0027;FR74","TERMINATED","discipline document type"
"CFIHOS-20000962","LA6958","A study describing priorities and criteria, practical restrictions, and options considered for route selection.  Includes route layout drawing and/or platform approach where applicable.","2017-02-13T21:51:20.370Z","2021-10-14T10:00:28.825Z",,"CR0027;FR27;FR74","STANDARD","discipline document type"
"CFIHOS-20000963","LA7180","A written account of activities, conditions, occurrences, observations, or investigations at a specific time. Not to be used if a more specific document type can be used.  Can be used for singular/specialty deliverables which do not have a unique document type. May include presentation.","2017-02-13T21:51:20.370Z","2021-10-14T10:00:28.825Z",,"CR0027;CR0030;FR27;FR74","STANDARD","discipline document type"
"CFIHOS-20000964","LA7205","A request, approval or rejection of changes to a technical specification. Would typically include justification and reasons for the request, and acceptance or rejection from a purely technical perspective. Synonym: Concession, Change Request.","2017-02-13T21:51:20.370Z","2021-10-14T10:00:28.825Z",,"CR0027;FR27;FR74","STANDARD","discipline document type"
"CFIHOS-20000965","LA7303","A request with a brief description of the parts to be ordered, with a statement of the pertinent drawings, specifications, etc., as well as a list of drawings and documents to be provided by the manufacturer/supplier.","2017-02-13T21:51:20.370Z","2021-10-14T10:00:28.825Z",,"CR0027;FR27;FR74","STANDARD","discipline document type"
"CFIHOS-20000966","LA7733","Includes hydrostatic, pneumatic, and leak tests/examinations.","2017-02-13T21:51:20.370Z","2021-10-14T10:00:28.825Z","2021-10-14T10:00:28.825Z","CR0027;FR74","TERMINATED","discipline document type"
"CFIHOS-20000967","LA7739","A specification describing scope and objectives of the project and its execution; details to be provided by Owner Operator.","2017-02-13T21:51:20.370Z","2021-10-14T10:00:28.825Z",,"CR0027;FR27;FR74","STANDARD","discipline document type"
"CFIHOS-20000968","LA7753","A document capturing scope and details of the activity to which it refers and any conditions relating to the appointment of a person(s) to undertake the activity. Includes the distribution of work, schedule and the responsibilities among the people participating in an evaluation process.","2017-02-13T21:51:20.370Z","2021-10-14T10:00:28.825Z",,"CR0027;FR27;FR74","STANDARD","discipline document type"
"CFIHOS-20000969","LA7770","A specification that describes the deliverable in terms of form, fit, function, and performance characteristics to satisfy the intended use where interpretation is required.Includes most discipline specifications describing the functionality (e.g., relief and blowdown specification, surface coating, inspection specifications, operating envelopes, etc.).","2017-02-13T21:51:20.370Z","2021-10-14T10:00:28.825Z",,"CR0027;CR0030;FR27;FR74","STANDARD","discipline document type"
"CFIHOS-20000970","LA7880","A document formally establishing the mandatory limits or parameters which are to be met. Not to be used if a more specific document type can be used.  Can be used for singular/specialty deliverables which do not have a unique document type.","2017-02-13T21:51:20.370Z","2021-10-14T10:00:28.825Z",,"CR0027;CR0030;FR27;FR74","STANDARD","discipline document type"
"CFIHOS-20000971","LA8005","A calculation to determine how a pipe or piping system behaves based on its material, pressure, temperature, fluid and support.","2017-02-13T21:51:20.370Z","2021-10-14T10:00:28.825Z",,"CR0027;CR0030;FR27;FR74","STANDARD","discipline document type"
"CFIHOS-20000972","LA8225",,"2017-02-13T21:51:20.370Z","2021-10-14T10:00:28.825Z","2021-10-14T10:00:28.825Z","CR0027;FR74","TERMINATED","discipline document type"
"CFIHOS-20000973","LA8247","A study describing required maintenance and integrity program elements for a pipeline, e.g., cleaning and intelligent (integrity test) pigging.","2017-02-13T21:51:20.370Z","2021-10-14T10:00:28.825Z",,"CR0027;FR27;FR74","STANDARD","discipline document type"
"CFIHOS-20000974","LA8263","A document detailing the result from thermal expansion and informing design regarding the need for loops and expansion joints.","2017-02-13T21:51:20.370Z","2021-10-14T10:00:28.825Z",,"CR0027;FR27;FR74","STANDARD","discipline document type"
"CFIHOS-20000975","LA8502","Request (e.g., from a Contractor) for clarification of scope, technical details, or assumptions. Synonyms include Technical Query (TQ) and Request for Information (RFI).","2017-02-13T21:51:20.370Z","2021-10-14T10:00:28.825Z",,"CR0027;FR27;FR74","STANDARD","discipline document type"
"CFIHOS-20000976","MH0709","An assessment which details the quantitative or qualitative risk related to a specific scenario presented to Company.","2017-02-13T21:51:20.370Z","2021-10-14T14:53:14.601Z","2021-10-14T14:53:14.601Z","CR0027;FR74","TERMINATED","discipline document type"
"CFIHOS-20000977","MH1206","A calculations prepared in order to prove that the item of equipment or system selected meets the design criteria.","2017-02-13T21:51:20.370Z","2021-10-14T10:00:28.825Z",,"CR0027;FR27;FR74","STANDARD","discipline document type"
"CFIHOS-20000978","MH1580","A document certifying compliance with specified requirements. [e.g., certificates needed for re-certifying, occupancy certificate, product certificates].Not to be used if a more specific document type can be used.  Can be used for singular/specialty deliverables which do not have a unique document type.","2017-02-13T21:51:20.370Z","2021-10-14T10:00:28.825Z",,"CR0027;FR27;FR74","STANDARD","discipline document type"
"CFIHOS-20000979","MH2105","A datasheet which provides precise information about a  tag and compliments equipment specification.","2017-02-13T21:51:20.370Z","2021-10-14T10:00:28.825Z",,"CR0027;CR0030;FR27;FR74","STANDARD","discipline document type"
"CFIHOS-20000980","MH2343","Construction detail diagram for Piping and Ducting, providing an accurate Bill of Materials (BOM) / Material Take Off (MTO) and represented in a 3 dimensional isometric view.","2017-02-13T21:51:20.370Z","2021-10-14T10:00:28.825Z",,"CR0027;FR27;FR74","STANDARD","discipline document type"
"CFIHOS-20000981","MH2407","A schematic diagram depicting an HVAC ducting system, including all items of duct mounted equipment complete with tag numbers, flow rate and duct sizing information.","2017-02-13T21:51:20.370Z","2021-10-14T10:00:28.825Z",,"CR0027;FR27;FR74","STANDARD","discipline document type"
"CFIHOS-20000982","MH2409","A schematic representation of an HVAC system indicating all HVAC equipment items and their control interfaces.  Abbreviation is typically D&ID.","2017-02-13T21:51:20.370Z","2021-10-14T10:00:28.825Z",,"CR0027;CR0030;FR27;FR74","STANDARD","discipline document type"
"CFIHOS-20000983","MH3309","A consolidated list of assemblies or bulk material showing the quantity of each required to suit a purpose. Use Bill of Materials for sub assemblies and parts.","2017-02-13T21:51:20.370Z","2021-10-14T10:00:28.825Z",,"CR0027;FR27;FR74","STANDARD","discipline document type"
"CFIHOS-20000984","MH3328","A document that describes methods of installing a piece of equipment.  Installation refers to the mounting, setting, erection, etc.","2017-02-13T21:51:20.370Z","2021-10-14T10:00:28.825Z",,"CR0027;FR27;FR74","STANDARD","discipline document type"
"CFIHOS-20000985","MH4018","A diagram showing the main features and locations of major items. Usually has some dimensions to convey spatial relationships but is generally inadequate for construction.","2017-02-13T21:51:20.370Z","2021-10-14T10:00:28.825Z",,"CR0027;CR0030;FR27;FR74","STANDARD","discipline document type"
"CFIHOS-20000986","MH4033","A diagram showing the precise location of assets/objects at a plant, process unit, or area basis relative to surrounding structures and equipment.","2017-02-13T21:51:20.370Z","2021-10-14T10:00:28.825Z",,"CR0027;FR27;FR74","STANDARD","discipline document type"
"CFIHOS-20000987","MH4311","Overview of all Certified Equipment.","2017-02-13T21:51:20.370Z","2021-10-14T10:00:28.825Z","2021-10-14T10:00:28.825Z","CR0027;FR74","TERMINATED","discipline document type"
"CFIHOS-20000988","MH5507","A document outlining the premise and intent for decisions that are to be followed regarding a design. A set of ideas, beliefs, or underlying theory.","2017-02-13T21:51:20.370Z","2021-10-14T10:00:28.825Z",,"CR0027;FR27;FR74","STANDARD","discipline document type"
"CFIHOS-20000989","MH5680","A document outlining the premise and intent for decisions that are to be followed regarding a specific subject. Typically provided as instruction from Owner Operator.","2017-02-13T21:51:20.370Z","2021-10-14T10:00:28.825Z",,"CR0027;FR27;FR74","STANDARD","discipline document type"
"CFIHOS-20000990","MH6180","A document which describes a set of logically sequenced instructions to execute an activity. Not to be used if a more specific document type can be used.  Can be used for singular/speciality deliverables which do not have a unique document type.","2017-02-13T21:51:20.370Z","2021-10-14T10:00:28.825Z",,"CR0027;FR27;FR74","STANDARD","discipline document type"
"CFIHOS-20000991","MH7180","A written account of activities, conditions, occurrences, observations, or investigations at a specific time. Not to be used if a more specific document type can be used.  Can be used for singular/specialty deliverables which do not have a unique document type. May include presentation.","2017-02-13T21:51:20.370Z","2021-10-14T10:00:28.825Z",,"CR0027;CR0030;FR27;FR74","STANDARD","discipline document type"
"CFIHOS-20000992","MH7205","A request, approval or rejection of changes to a technical specification. Would typically include justification and reasons for the request, and acceptance or rejection from a purely technical perspective. Synonym: Concession, Change Request.","2017-02-13T21:51:20.370Z","2021-10-14T10:00:28.825Z",,"CR0027;FR27;FR74","STANDARD","discipline document type"
"CFIHOS-20000993","MH7303","A request with a brief description of the parts to be ordered, with a statement of the pertinent drawings, specifications, etc., as well as a list of drawings and documents to be provided by the manufacturer/supplier.","2017-02-13T21:51:20.370Z","2021-10-14T10:00:28.825Z",,"CR0027;FR27;FR74","STANDARD","discipline document type"
"CFIHOS-20000994","MH7739","A specification describing scope and objectives of the project and its execution; details to be provided by Owner Operator.","2017-02-13T21:51:20.370Z","2021-10-14T10:00:28.825Z",,"CR0027;FR27;FR74","STANDARD","discipline document type"
"CFIHOS-20000995","MH7753","A document capturing scope and details of the activity to which it refers and any conditions relating to the appointment of a person(s) to undertake the activity. Includes the distribution of work, schedule and the responsibilities among the people participating in an evaluation process.","2017-02-13T21:51:20.370Z","2021-10-14T10:00:28.825Z",,"CR0027;FR27;FR74","STANDARD","discipline document type"
"CFIHOS-20000996","MH7770","A specification that describes the deliverable in terms of form, fit, function, and performance characteristics to satisfy the intended use where interpretation is required.Includes most discipline specifications describing the functionality (e.g., relief and blowdown specification, surface coating, inspection specifications, operating envelopes, etc.).","2017-02-13T21:51:20.370Z","2021-10-14T10:00:28.825Z",,"CR0027;CR0030;FR27;FR74","STANDARD","discipline document type"
